{
  "schema": "GloamsteadForgeRuntimeReport/v1",
  "scenario_id": "corruption_success",
  "generated_at_utc": "2026-07-11T18:00:00Z",
  "git_commit": "fixturefixturefixturefixturefixture0001",
  "git_branch": "fixtures",
  "engine": "UE5.8",
  "quiet": false,
  "continuity": false,
  "human_playtest": false,
  "pcg_init": { "initialized": true, "point_count": 4 },
  "restoration": { "attempted": true, "applied": true, "point_index": 0 },
  "night_loop": { "started": true, "night_type": "Corruption", "objective_kind": "CleanseCorruptionBloom", "target_point_index": 0, "objective_resolved": true, "ended_intentionally": true, "outcome_result": "Success", "result_tag": "CorruptionCleansed" },
  "sanctuary_state": { "avg_corruption_before": 0.28, "avg_corruption_after": 0.05, "target_corruption_before": 0.8, "target_corruption_after": 0.0, "mutated": true },
  "dawn_reflection": { "consumed_outcome": true, "outcome_result": "Success" },
  "save_load": { "checked": false, "roundtrip_ok": false },
  "failure_codes": []
}
